<?xml version="1.0" encoding="UTF-8"?>
<xs:schema xmlns:xs="http://www.w3.org/2001/XMLSchema">
    <xs:element name="dataDocument">
        <xs:complexType>
            <xs:all>
                <xs:element name="engineType">
                    <xs:complexType>
                        <xs:sequence>
                            <xs:element name="submitter" type="Identifier" maxOccurs="unbounded"/>
                            <xs:element name="walker" type="Identifier" maxOccurs="unbounded"/>
                        </xs:sequence>
                    </xs:complexType>
                </xs:element>
            </xs:all>
        </xs:complexType>
    </xs:element>
    <xs:complexType name="Identifier">
        <xs:sequence>
            <xs:element name="id" type="xs:string" maxOccurs="unbounded"/>
        </xs:sequence>
    </xs:complexType>
</xs:schema>