<?xml version="1.0"?>
<dataDocument xmlns:xsi="http://www.w3.org/2001/XMLSchema-instance" xsi:schemaLocation="example-27.xsd example-27.xsd">
    <a>
        <submitter>
            <id>FISH</id>
            <id>CHIPS</id>
        </submitter>
        <walker>
            <id>SAUSAGE</id>
            <id>MASH</id>
        </walker>
    </a>
</dataDocument>